{
  "col_labels": [
    "p-coord"
  ],
  "created_at": "1970-01-01T00:00:00Z",
  "id": "agentic-pack-multi-agent-coordination-example-grid",
  "matrix_kind": "grid",
  "metric": "total_weighted_rubric_score",
  "row_labels": [
    "v-cli",
    "v-repo"
  ],
  "scores": [
    [
      0.285726
    ],
    [
      0.683224
    ]
  ],
  "title": "Agentic pack \u2014 multi-agent coordination (per-prompt scores)"
}
