{
  "col_labels": [
    "p-one",
    "p-two"
  ],
  "created_at": "1970-01-01T00:00:00Z",
  "id": "campaign.examples.multi_suite.v1__0001-grid",
  "matrix_kind": "grid",
  "metric": "total_weighted_rubric_score",
  "row_labels": [
    "v-cli",
    "v-browser",
    "v-repo"
  ],
  "scores": [
    [
      0.843873,
      0.106266
    ],
    [
      0.306161,
      0.652089
    ],
    [
      0.065653,
      0.229465
    ]
  ],
  "title": "Offline benchmark harness (mock backends) (per-prompt scores)"
}
