{
  "col_labels": [
    "p-browser"
  ],
  "created_at": "1970-01-01T00:00:00Z",
  "id": "agentic-pack-browser-interpretation-example-grid",
  "matrix_kind": "grid",
  "metric": "total_weighted_rubric_score",
  "row_labels": [
    "v-browser"
  ],
  "scores": [
    [
      0.504573
    ]
  ],
  "title": "Agentic pack \u2014 browser evidence interpretation (per-prompt scores)"
}
