{
  "col_labels": [
    "p-one"
  ],
  "created_at": "1970-01-01T00:00:00Z",
  "id": "campaign.examples.browser_evidence_compare.v1__0001-grid",
  "matrix_kind": "grid",
  "metric": "total_weighted_rubric_score",
  "row_labels": [
    "v-form"
  ],
  "scores": [
    [
      0.36131
    ]
  ],
  "title": "Browser file-runner benchmark (form validation fixture) (per-prompt scores)"
}
