{
  "col_labels": [
    "p-author"
  ],
  "created_at": "1970-01-01T00:00:00Z",
  "id": "agentic-pack-benchmark-authoring-example-grid",
  "matrix_kind": "grid",
  "metric": "total_weighted_rubric_score",
  "row_labels": [
    "v-cli"
  ],
  "scores": [
    [
      0.236089
    ]
  ],
  "title": "Agentic pack \u2014 benchmark suite authoring (per-prompt scores)"
}
