{
  "col_labels": [
    "v-cli",
    "v-browser",
    "v-repo"
  ],
  "created_at": "1970-01-01T00:00:00Z",
  "id": "campaign.examples.multi_suite.v1__0001-pairwise",
  "matrix_kind": "pairwise",
  "metric": "mean_abs_total_score_delta",
  "row_labels": [
    "v-cli",
    "v-browser",
    "v-repo"
  ],
  "scores": [
    [
      0.0,
      0.5417675,
      0.4507095
    ],
    [
      0.5417675,
      0.0,
      0.331566
    ],
    [
      0.4507095,
      0.331566,
      0.0
    ]
  ],
  "title": "Offline benchmark harness (mock backends) (mean abs score delta across prompts)"
}
