{
  "col_labels": [
    "p1"
  ],
  "created_at": "1970-01-01T00:00:00Z",
  "id": "campaign.examples.minimal_offline.v1__0000-grid",
  "matrix_kind": "grid",
  "metric": "total_weighted_rubric_score",
  "row_labels": [
    "v-cli"
  ],
  "scores": [
    [
      0.667276
    ]
  ],
  "title": "Campaign micro fixture (per-prompt scores)"
}
