{
  "col_labels": [
    "p-drift"
  ],
  "created_at": "1970-01-01T00:00:00Z",
  "id": "agentic-pack-docs-drift-example-grid",
  "matrix_kind": "grid",
  "metric": "total_weighted_rubric_score",
  "row_labels": [
    "v-cli"
  ],
  "scores": [
    [
      0.699601
    ]
  ],
  "title": "Agentic pack \u2014 docs drift repair (per-prompt scores)"
}
