{
  "col_labels": [
    "v-cli"
  ],
  "created_at": "1970-01-01T00:00:00Z",
  "id": "agentic-pack-benchmark-authoring-example-pairwise",
  "matrix_kind": "pairwise",
  "metric": "mean_abs_total_score_delta",
  "row_labels": [
    "v-cli"
  ],
  "scores": [
    [
      0.0
    ]
  ],
  "title": "Agentic pack \u2014 benchmark suite authoring (mean abs score delta across prompts)"
}
