{
  "col_labels": [
    "v-checkout"
  ],
  "created_at": "1970-01-01T00:00:00Z",
  "id": "campaign.examples.browser_evidence_compare.v1__0000-pairwise",
  "matrix_kind": "pairwise",
  "metric": "mean_abs_total_score_delta",
  "row_labels": [
    "v-checkout"
  ],
  "scores": [
    [
      0.0
    ]
  ],
  "title": "Browser file-runner benchmark (checkout fixture) (mean abs score delta across prompts)"
}
