{
  "col_labels": [
    "p-md",
    "p-browser"
  ],
  "created_at": "1970-01-01T00:00:00Z",
  "id": "examples-registry-generous-duo-grid",
  "matrix_kind": "grid",
  "metric": "total_weighted_rubric_score",
  "row_labels": [
    "v-cli",
    "v-browser"
  ],
  "scores": [
    [
      0.124068,
      0.160472
    ],
    [
      0.629908,
      0.672867
    ]
  ],
  "title": "Generous rubric \u2014 Markdown synthesis + browser evidence (dual modes) (per-prompt scores)"
}
